CUI,Description,DescriptionSource,Description-GPT
C0336721,None,None,None
C0030705,"Individuals participating in the health care system for the purpose of receiving therapeutic, diagnostic, or preventive procedures.",MSH,"Patients seeking medical care for treatments, tests, or preventive measures from healthcare providers in the health care system."
C1696103,"<b>Description:</b>A characteristic representing a single file reference that contains two or more views of the same dosage form of the product; in most cases this should represent front and back views of the dosage form, but occasionally additional views might be needed in order to capture all of the important physical characteristics of the dosage form. Any imprint and/or symbol should be clearly identifiable, and the viewer should not normally need to rotate the image in order to read it. Images that are submitted with SPL should be included in the same directory as the SPL file.",HL7V3.0,"Images of product dosage form with multiple views, including imprint and symbol, should be easily identifiable without rotation."
C0040405,Tomography using x-ray transmission and a computer algorithm to reconstruct the image.,MSH,Tomography uses x-rays and a computer algorithm to create images by reconstructing data obtained through x-ray transmission.
C0221198,"A localized pathological or traumatic structural change, damage, deformity, or discontinuity of tissue, organ, or body part.",NCI,"An abnormal alteration in structure or function of a body part, caused by injury, disease, or genetic disorder."
C0000726,That portion of the body that lies between the THORAX and the PELVIS.,MSH,"The area between the chest and the lower abdomen is known as the medical term, ""abdomen."""
C0024485,Non-invasive method of demonstrating internal anatomy based on the principle that atomic nuclei in a strong magnetic field absorb pulses of radiofrequency energy and emit them as radiowaves which can be reconstructed into computerized images. The concept includes proton spin tomographic techniques.,MSH,Non-invasive imaging using strong magnetic fields and radio waves reconstructs computerized images of internal anatomy.
C0439231,"One of the 12 divisions of a year as determined by a calendar. It corresponds to the unit of time of approximately to one cycle of the moon's phases, about 30 days or 4 weeks.",NCI,"A month is a 30-day division of the year based on the lunar cycle, corresponding to the moon's phases."
C0009244,"A directive form of psychotherapy based on the interpretation of situations (cognitive structure of experiences) that determine how an individual feels and behaves. It is based on the premise that cognition, the process of acquiring knowledge and forming beliefs, is a primary determinant of mood and behavior. The therapy uses behavioral and verbal techniques to identify and correct negative thinking that is at the root of the aberrant behavior.",MSH,Cognitive therapy focuses on changing negative thoughts to improve mood and behavior through behavioral and verbal techniques.
C0441889,"A position on a scale measuring intensity, quality, or amount.",NCI,"Summary: A medical keyword indicating a point on a scale measuring intensity, quality, or quantity."
C0577559,"A benign or malignant pathologic structure in any part of the body, resulting from a neoplastic accumulation of cells, inflammatory cells, or cystic changes.",NCI,"A tumor is an abnormal growth caused by an accumulation of cells, inflammation, or cystic changes in the body."
C0043210,"Human females as cultural, psychological, sociological, political, and economic entities.",MSH,"Women as multifaceted beings influenced by various factors such as culture, psychology, sociology, politics, and economics."
C0238767,Affecting both sides of the body or a matched pair of organs.,NCI,Bilateral impact pertains to a condition that affects paired organs or both sides of the body equally.
C0030797,The space or compartment surrounded by the pelvic girdle (bony pelvis). It is subdivided into the greater pelvis and LESSER PELVIS. The pelvic girdle is formed by the PELVIC BONES and SACRUM.,MSH,"The pelvic girdle surrounds the pelvic cavity, which is divided into the greater and lesser pelvis by bones."
C0439234,"A period of time that it takes for Earth to make a complete revolution around the sun, approximately 365 days; a specific one year period.",NCI,"The medical keyword is ""year,"" referring to Earth's revolution around the sun, lasting approximately 365 days or one year."
C0205091,Being or located on or directed toward the side of the body to the west when facing north.,NCI,"On the left side of the body when facing forwards and looking towards the north, also known as lateral."
C0817096,"The upper part of the trunk between the NECK and the ABDOMEN. It contains the chief organs of the circulatory and respiratory systems. (From Stedman, 25th ed)",MSH,"The thorax is the area between the neck and abdomen, housing vital organs for circulation and respiration."
C0041618,The visualization of deep structures of the body by recording the reflections or echoes of ultrasonic pulses directed into the tissues. Use of ultrasound for imaging or diagnostic purposes employs frequencies ranging from 1.6 to 10 megahertz.,MSH,Ultrasound uses reflected ultrasonic pulses to create images of deep body structures for imaging and diagnostic purposes.
C0027651,"New abnormal growth of tissue. Malignant neoplasms show a greater degree of anaplasia and have the properties of invasion and metastasis, compared to benign neoplasms.",MSH,Malignant neoplasms are aggressive abnormal growths that can invade and spread to other parts of the body.
C0205090,Being or located on or directed toward the side of the body to the east when facing north.,NCI,The medical keyword refers to a body part or position situated on the east side when facing north.
C0039985,An x-ray examination of the chest.,NCI,An x-ray of the chest is used to diagnose and monitor conditions ranging from pneumonia to lung cancer.
C0439228,"The time for Earth to make a complete rotation on its axis; ordinarily divided into twenty-four hours, equal to 86 400 seconds. This also refers to a specific day.",NCI,"The medical keyword refers to the duration of Earth's full rotation on its axis, equal to 24 hours."
C0034579,"Extraoral body-section radiography depicting an entire maxilla, or both maxilla and mandible, on a single film.",MSH,"Full-face dental x-rays show upper jaw or both upper and lower jaw on one film, allowing comprehensive assessment."
C0023884,"A large lobed glandular organ in the abdomen of vertebrates that is responsible for detoxification, metabolism, synthesis and storage of various substances.",MSH,"The liver is an important organ in vertebrates, performing detoxification, metabolism, synthesis, and storage of various substances."
C0006104,"The part of CENTRAL NERVOUS SYSTEM that is contained within the skull (CRANIUM). Arising from the NEURAL TUBE, the embryonic brain is comprised of three major parts including PROSENCEPHALON (the forebrain); MESENCEPHALON (the midbrain); and RHOMBENCEPHALON (the hindbrain). The developed brain consists of CEREBRUM; CEREBELLUM; and other structures in the BRAIN STEM.",MSH,The brain is part of the central nervous system located within the skull and consists of three major parts.
C0032790,The period following a surgical operation.,MSH,The time after surgery where the body recovers and heals is known as the postoperative period.
C0445204,Relating to or occurring during the period immediately before a surgical operation.,NCI,"""Preoperative refers to events or processes that happen before a surgical procedure takes place in a medical setting."""
C0086582,"A person who belongs to the sex that normally produces sperm. The term is used to indicate biological sex distinctions, cultural gender role distinctions, or both.",NCI,"The medical keyword ""male"" refers to the sex that typically produces sperm and encompasses both biological and cultural aspects."
C0009924,Substances used to allow enhanced visualization of tissues.,MSH,Substances enhancing tissue visualization aid in better examination and identification of medical conditions through improved imaging.
C0205217,None,None,None
C0233426,None,None,None
C0225317,"A general term comprising tissue that is not hardened or calcified; including muscle, fat, blood vessels, nerves, tendons, ligaments and fascia.",NCI,"Soft tissues include muscle, fat, blood vessels, nerves, tendons, ligaments, and fascia and are not hardened or calcified."
C0439230,Any period of seven consecutive days.,NCI,"A medical keyword meaning a continuous week, typically consisting of seven consecutive days."
C0025266,"Human males as cultural, psychological, sociological, political, and economic entities.",MSH,"The keyword focuses on human males and their role in various aspects of society including culture, psychology, and economics."
C0150312,Being or existing in a specified place or at the specified time.,NCI,Location or time-specific presence.
C0205107,Most near in time or space.,NCI,Proximity in time or space is the defining characteristic of this medical keyword mentioned in the description.
C1301886,The length of a straight line passing through the center of a circle or sphere and connecting two points on the circumference.,NCI,The diameter is the distance between two points on a circle or sphere passing through its center.
C0444706,Having been determined by measurement.,NCI,"Medical parameters are quantified through measurements to accurately assess a condition, track progress, or determine treatment effectiveness."
C0332290,Marked by a reasonable or logical relation of parts and holding together as a harmonious or credible whole.,NCI,"The medical term is characterized by a coherent structure that is logical, credible, and cohesive in its entirety."
C0021107,A surgical procedure that places something in the human body.,NCI,A surgical implantation procedure that inserts an object or substance into the body for medical purposes.
C0005682,"A musculomembranous sac along the URINARY TRACT. URINE flows from the KIDNEYS into the bladder via the ureters (URETER), and is held there until URINATION.",MSH,The bladder is a sac along the urinary tract that holds urine from the kidneys until it is released.
C0225897,The left lower chamber of the heart that receives blood from the left atrium and pumps it through the aorta to the body.,NCI,The left ventricle receives blood from the left atrium and pumps it through the aorta to the body.
C0225860,"One of four chambers of the heart, which receives blood from the pulmonary veins and pumps blood through the mitral valve into the left ventricle.",NCI,The left atrium receives oxygenated blood and pumps it through the mitral valve into the left ventricle.
C0024109,Either of the pair of organs occupying the cavity of the thorax that effect the aeration of the blood.,MSH,Lung pair in thoracic cavity oxygenates blood.
C0039798,"Used with diseases for therapeutic interventions except drug therapy, diet therapy, radiotherapy, and surgery, for which specific subheadings exist. The concept is also used for articles and books dealing with multiple therapies.",MSH,"Non-drug, non-diet, non-radiation, and non-surgical treatments used for diseases, including multiple therapies in articles and books."
C0006660,Process by which organic tissue becomes hardened by the physiologic deposit of calcium salts.,MSH,Organic tissue becomes hardened by the deposit of calcium salts through the process known as calcification.
C0453107,None,None,None
C0019409,The quality or state of consisting of elements that are not of the same kind or nature.,NCI,"Heterogeneity in medicine refers to the presence of varying elements in a state or quality, differing in kind or nature."
C2607943,None,None,None
C0011900,"The determination of the nature of a disease or condition, or the distinguishing of one disease or condition from another. Assessment may be made through physical examination, laboratory tests, or the likes. Computerized programs may be used to enhance the decision-making process.",MSH,"Diagnosing a disease involves examining symptoms, conducting tests, and using computer programs to identify and distinguish conditions."
C0038894,The branch of medical science that treats disease or injury by operative procedures.,NCI,Surgery is the branch of medicine that uses operative procedures to treat diseases or injuries in patients.
C0184666,Performance of the steps necessary to admit a patient to a hospital,SNOMEDCT_US,Summary: Admitting a patient to a hospital involves executing the required steps for their admission process.
C0002978,Radiography of blood vessels after injection of a contrast medium.,MSH,Contrast medium injection is used to perform radiography on blood vessels to visualize and assess their condition.
C0027530,The part of a human or animal body connecting the HEAD to the rest of the body.,MSH,"The neck serves as a biological bridge between the head and the body, allowing for communication and support."
C0205400,An increase in the thickness of a structure.,NCI,"Thickening of a structure refers to an abnormal growth or swelling, often indicating a medical condition or disease present."
C0225844,"One of the four chambers of the heart, which is located immediately superior to the right ventricle, and which receives deoxygenated venous blood from the systemic circulation.",NCI,The right atrium is a heart chamber that receives deoxygenated blood from the body's systemic circulation.
C0003483,The main trunk of the systemic arteries.,MSH,The systemic arteries are the main branches that carry oxygenated blood from the heart to the rest of the body.
C0205094,Denoting the front surface of the body; often used to indicate the position of one structure relative to another.,NCI,Describing the front of the body and indicating the position of one structure in relation to another.
C0205082,Used to describe tumor samples that exhibit poorly differentiated or undifferentiated cells. They are generally expected to be fast growing and aggressive.,NCI,"Poorly differentiated or undifferentiated tumor samples have fast-growing, aggressive cells, lacking distinct characteristics or specialization."
C0225883,The lower chamber of the heart located in the right side. It receives blood from the right atrium that is no longer oxygenated and it pumps it to the pulmonary artery.,NCI,The right ventricle receives deoxygenated blood from the right atrium and pumps it to the pulmonary artery.
C0205131,Situated on or along or in the direction of an axis.,NCI,Located on or parallel to the center line or axis of the body or structure.
C1306645,An image produced on a radiosensitive surface by x-ray radiation that has penetrated and passed through a structure.,NCI,An x-ray image is created on a specialized surface when radiation passes through and illuminates structures within the body.
C0589120,None,None,None
C0024687,The largest and strongest bone of the FACE constituting the lower jaw. It supports the lower teeth.,MSH,"The mandible is the largest bone in the face, supporting the lower teeth and serving as a strong foundation."
C0016658,Breaks in bones.,MSH,"Bone fractures are breaks in the structure of bones, resulting in damage to their integrity and continuity."
C0439064,An indefinite large quantity that is considered to be greater than several.,NCI,An abundance in medical terms described as exceeding several but without a defined quantity.
C0021485,None,None,None
C0205161,"Deviating in any way from the state, position, structure, condition, behavior, or rule which is considered a norm.",NCI,"The medical keyword describes anything that differs from the accepted norm in terms of state, structure, position, or behavior."
C0456389,The physical magnitude of something.,NCI,"Physical magnitude refers to the size, amount, or intensity of something in a medical context."
C0002940,"Pathological outpouching or sac-like dilatation in the wall of any blood vessel (ARTERIES or VEINS) or the heart (HEART ANEURYSM). It indicates a thin and weakened area in the wall which may later rupture. Aneurysms are classified by location, etiology, or other characteristics.",MSH,"Aneurysms are sac-like dilatations in blood vessels or the heart, indicating weak areas that may rupture. They pose risks."
C0038351,An organ of digestion situated in the left upper quadrant of the abdomen between the termination of the ESOPHAGUS and the beginning of the DUODENUM.,MSH,The stomach is a digestive organ located in the upper left abdomen between the esophagus and the duodenum.
C0242485,Annotation used to indicate the size or magnitude of something that was determined by comparison to a standard.,NCI,Annotation used to indicate size by comparing to a standard.
C0013604,Abnormal fluid accumulation in TISSUES or body cavities. Most cases of edema are present under the SKIN in SUBCUTANEOUS TISSUE.,MSH,"""Edema is abnormal fluid buildup in tissues or body cavities, with most cases occurring under the skin."""
C1514893,"Return to the normal structure and/or function, e.g. the subsidence of a pathologic process, as the subsidence of an inflammatory lesion or new growth.",NCI,"Recovery involves the restoration of normal structure and function, such as the resolution of inflammation or regression of growth."
C0332281,Joined in some kind of relationship.,NCI,"Interconnected, intertwined or associated with another entity, such as in a physiological or anatomical relationship."
C0018944,"A collection of blood outside the BLOOD VESSELS. Hematoma can be localized in an organ, space, or tissue.",MSH,"Blood outside vessels, known as hematoma, can collect in organs, spaces, or tissues causing localized swelling and pain."
C0023031,"The prototypical element in the rare earth family of metals. It has the atomic symbol La, atomic number 57, and atomic weight 138.91. Lanthanide ion is used in experimental biology as a calcium antagonist; lanthanum oxide improves the optical properties of glass.",MSH,"Lanthanum (La) is a rare earth metal with atomic number 57, used as a calcium antagonist in experimental biology."
C0392747,The act of alteration or modification; changed or altered in form or character.,NCI,"The process of changing something, resulting in a new form or character."
C0332197,Not existing in a specified place at a specified time.,NCI,Absence of a condition or entity in a specific location and timeframe.
C1710082,"A detectable physical quantity or impulse (e.g., voltage, current, or magnetic field strength).",NCI,"A measurable signal such as voltage, current, or magnetic field strength used in medical monitoring and diagnostics."
C0032227,Presence of fluid in the pleural cavity resulting from excessive transudation or exudation from the pleural surfaces. It is a sign of disease and not a diagnosis in itself.,MSH,"Presence of pleural effusion indicates excessive fluid in pleural cavity, result of transudation or exudation, signaling underlying disease."
C0002059,An enzyme that catalyzes the conversion of an orthophosphoric monoester and water to an alcohol and orthophosphate. EC 3.1.3.1.,MSH,An enzyme that helps convert a type of chemical compound into alcohol and orthophosphate through a catalytic process.
C0087086,None,None,None
C0017446,The continents and countries situated on those continents; the UNITED STATES and each of the constituent states arranged by region; CANADA and each of its provinces; AUSTRALIA and each of its states; the major bodies of water and major islands on both hemispheres; and selected major cities.,MSH,"This medical keyword describes the geographical regions and locations globally, including countries, states, bodies of water, and cities."
C0023128,"A country located in Eastern Europe, bordering the Baltic Sea, between Estonia and Lithuania. The capital is Riga.",MSH,"Eastern European country with Baltic Sea border, between Estonia and Lithuania, capital is Riga. (20 words)"
C0205108,"Situated farthest from a point of attachment or origin, as of a limb or bone; or directed away from the midline of the body.",NCI,"Farthest and directed away from the body's midline, such as a limb or bone, is the distal position."
C1627358,None,None,None
C0450429,"A position, site, or point in space where something can be found.",NCI,A specific location in the body where a medical condition or structure can be identified or observed.
C0012751,The space separating two objects or points.,NCI,The anatomical term for the space between two objects or points is known as the interspace.
C0015252,The surgical removal of an organ or a part of an organ.,NCI,"Surgical removal of an organ or part is known as resection, with the aim of treating or preventing disease."
C0016169,"Abnormal communication most commonly seen between two internal organs, or between an internal organ and the surface of the body.",MSH,Abnormal communication between internal organs or between an organ and the body surface is known as a fistula.
C0205095,Pertaining to the back or upper surface of the body; opposite of ventral.,NCI,"The term describes the back or upper body surface, opposite the ventral or front side of the body."
C0226032,A left coronary artery branch that descends on the anterior portion of the heart through the anterior interventricular groove.,NCI,A descending left coronary artery branch travels on the front of the heart through the anterior interventricular groove.
C0005889,Liquid components of living organisms.,MSH,Fluids in living things.
C0005931,"A specialized CONNECTIVE TISSUE that is the main constituent of the SKELETON. The principal cellular component of bone is comprised of OSTEOBLASTS; OSTEOCYTES; and OSTEOCLASTS, while FIBRILLAR COLLAGENS and hydroxyapatite crystals form the BONE MATRIX.",MSH,"Bone is a connective tissue that makes up the skeleton, with cells like osteoblasts, osteocytes, and osteoclasts, and collagen fibers."
C0030274,A nodular organ in the ABDOMEN that contains a mixture of ENDOCRINE GLANDS and EXOCRINE GLANDS. The small endocrine portion consists of the ISLETS OF LANGERHANS secreting a number of hormones into the blood stream. The large exocrine portion (EXOCRINE PANCREAS) is a compound acinar gland that secretes several digestive enzymes into the pancreatic ductal system that empties into the DUODENUM.,MSH,"The pancreas is an abdominal organ with both endocrine and exocrine functions, secreting hormones and enzymes respectively."
C0021102,A prosthesis placed permanently in tissue.,NCI,A permanent prosthesis is surgically implanted into tissue to replace or support a missing or damaged body part.
C0441635,One of the parts into which something naturally divides.,NCI,"A naturally dividing part, typically found in medical context."
C1314939,To have a connection by participation or association or use; sharing in an activity or process.,NCI,"Having a partnership or involvement in a common activity or process, such as in a medical research study."
C0005400,"The channels that collect and transport the bile secretion from the BILE CANALICULI, the smallest branch of the BILIARY TRACT in the LIVER, through the bile ductules, the bile ducts out the liver, and to the GALLBLADDER for storage.",MSH,Bile ducts collect and transport bile from liver bile canaliculi to gallbladder for storage via bile ductules.#
C0205143,The inclination of one line to another or the plane of one object to another.,NCI,"The angular relationship between two lines or objects, known as the inclination or plane."
C0038257,Devices that provide support for tubular structures that are being anastomosed or for body cavities during skin grafting.,MSH,Supportive devices aid in connecting tubular structures or during skin grafting by stabilizing body cavities or anastomoses.
C0001861,"The mixture of gases present in the earth's atmosphere consisting of oxygen, nitrogen, carbon dioxide, and small amounts of other gases.",MSH,"Earth's atmosphere is a mix of oxygen, nitrogen, carbon dioxide, and trace gases essential for life on our planet."
C0035190,The volume of air remaining in the LUNGS at the end of a maximal expiration. Common abbreviation is RV.,MSH,"RV is the abbreviation for residual volume, which refers to the air remaining in the lungs after a full exhale."
C0010709,"Any fluid-filled closed cavity or sac that is lined by an EPITHELIUM. Cysts can be of normal, abnormal, non-neoplastic, or neoplastic tissues.",MSH,"Cysts are fluid-filled sacs lined by epithelium, which can contain normal or abnormal tissues, and can be neoplastic."
C0022646,Body organ that filters blood for the secretion of URINE and that regulates ion concentrations.,MSH,Kidney filters blood for urine secretion and ion regulation.
C2945706,None,None,None
C3887511,Knowledge on which to base belief.,NCI,Information needed for forming opinions or making decisions in the medical field is crucial for optimal patient care.
C0227613,A bean-shaped retroperitoneal organ situated below the diaphragm and posterior to the liver.,NCI,"The organ, located behind the liver, is bean-shaped and positioned below the diaphragm in the retroperitoneum."
C0013303,The shortest and widest portion of the SMALL INTESTINE adjacent to the PYLORUS of the STOMACH. It is named for having the length equal to about the width of 12 fingers.,MSH,"The duodenum is the first segment of the small intestine, located near the stomach's pylorus, measuring approximately 12 finger-widths."
C0002893,"A severe sometimes chronic anemia, usually macrocytic in type, that does not respond to ordinary antianemic therapy.",MSH,Intractable macrocytic anemia resistant to standard treatments and can persist in its severe form for extended periods.
C0231448,To increase in length or duration.,NCI,To extend or prolong something.
