CUI,Description,DescriptionSource,Description-GPT
C0227614,A bean-shaped retroperitoneal organ situated below the diaphragm and posterior to the spleen.,NCI,The kidney is a retroperitoneal organ located below the diaphragm and behind the spleen in the human body.
C0015376,"The leakage of body fluid or cells from the vascular system to the surrounding tissues. This process occurs either by force or as a result of a pathologic reaction (e.g., inflammation). This process may sometimes allow cancer cells to migrate from capillaries to adjacent tissues, initiating micro-metastases.",NCI,Leakage of fluid or cells from blood vessels to tissues can lead to cancer spread through micro-metastases.
C0332459,None,None,None
C0037993,An encapsulated lymphatic organ through which venous blood filters.,MSH,"The spleen is a filter for venous blood in the lymphatic system, functioning as an encapsulated organ in the body."
C0301630,A chemical reaction that results in a gain of electrons by one of the chemical species involved in the reaction.,NCI,A reduction reaction involves the gaining of electrons by a chemical species during a chemical reaction.
C0449450,To show or display; the act of presenting something to sight or view: how something looks.,NCI,"The term ""appearance"" refers to the visual presentation or display of something, such as how it looks or appears."
C0034571,"Used with organs, regions, and diseases for x-ray examinations.",MSH,"X-ray examinations are used with organs, regions, and diseases to diagnose and monitor health conditions in patients."
C0206054,"Ultrasonic recording of the size, motion, and composition of the heart and surrounding tissues using a transducer placed in the esophagus.",MSH,"Ultrasonic recording of heart and surrounding tissues using an esophageal transducer to measure size, motion, and composition."
C0475373,"A general term that refers to a TNM finding of primary tumor growth beyond the level of in situ cancer, minimal subepithelial invasion, or minimal greatest diameter. The definition of T2 TNM finding depends on the specific type of cancer that it refers to; for example, for breast cancer it refers to primary tumor that is more than 2.0 cm, but not more than 5.0 cm in greatest dimension; for cutaneous melanoma it refers to primary tumor that is 1.01 to 2 mm in thickness, with or without ulceration; for colorectal cancer it refers to primary tumor with invasion into the muscularis propria; and for bladder cancer it refers to primary tumor with invasion into the muscle layer.",NCI,"T2 TNM finding indicates primary tumor growth beyond in situ cancer, minimal invasion, or minimal diameter in various cancers."
C0205117,Next to or adjoining.,NCI,"Adjacent: An area that is next to or touching another, usually referring to body structures or organs in medicine."
C0202823,Computed tomography of the chest.,NCI,Chest CT is a medical imaging technique that provides detailed cross-sectional images of the chest region.
C0243144,"The absorption by a tissue of some substance, food material, mineral, etc., and its permanent or temporary retention.",NCI,"Tissue absorbs substance, food, or mineral, temporarily or permanently retaining it in the body for various purposes."
C0028259,"A small lump, swelling or collection of tissue.",NCI,A small bump or mass of tissue that is swollen and may be located under the skin or inside the body.
C1280412,"Wide in width, extent or cross-section.",NCI,This medical keyword describes a condition or object that is large or broad in size or dimension.
C0027627,The transfer of a neoplasm from one organ or part of the body to another remote from the primary site.,MSH,Metastasis refers to the spread of cancer cells from the original site to other parts of the body.
C0332463,None,None,None
C0020564,"General increase in bulk of a part or organ due to CELL ENLARGEMENT and accumulation of FLUIDS AND SECRETIONS, not due to tumor formation, nor to an increase in the number of cells (HYPERPLASIA).",MSH,"Increase in size of organ from cell enlargement and fluid accumulation, not due to tumor formation or cell increase."
C0392756,Made less in size or amount or degree.,NCI,"Reduced in size, amount, or degree; a decrease in the overall magnitude or intensity of a medical condition."
C0031809,Systematic and thorough inspection of the patient for physical signs of disease or abnormality.,MSH,Complete physical examination to look for signs of illness or abnormalities in the patient's body.
C0013516,"Ultrasonic recording of the size, motion, and composition of the heart and surrounding tissues. The standard approach is transthoracic.",MSH,"Ultrasonic imaging of heart and tissues, typically done through transthoracic approach. Size, motion, and composition are evaluated."
C0040578,The cartilaginous and membranous tube descending from the larynx and branching into the right and left main bronchi.,MSH,"Descend from larynx, divide into two main bronchi: cartilaginous and membranous tube known as trachea."
C0001168,None,None,None
C0034052,The short wide vessel arising from the conus arteriosus of the right ventricle and conveying unaerated blood to the lungs.,MSH,The pulmonary artery carries deoxygenated blood from the right ventricle to the lungs for oxygenation and exchange.
C0227481,The larger lobe of the liver extending into the right side of the body.,NCI,The main part of the liver that extends into the right side of the body is the right lobe.
C0871362,None,None,None
C0014876,The muscular membranous segment between the PHARYNX and the STOMACH in the UPPER GASTROINTESTINAL TRACT.,MSH,The muscular membranous section connecting the pharynx and stomach in the upper gastrointestinal tract is the esophagus.
C0205271,Lacking perfect symmetry or evenness.,NCI,Not having equal sides or proportions; asymmetry is present in the medical condition described.
C0085532,Radiography of the vascular system of the heart muscle after injection of a contrast medium.,MSH,"Summary: ""Visualizing the heart's blood vessels using contrast dye through radiography."""
C0046056,"The compound is given by intravenous injection to do POSITRON-EMISSION TOMOGRAPHY for the assessment of cerebral and myocardial glucose metabolism in various physiological or pathological states including stroke and myocardial ischemia. It is also employed for the detection of malignant tumors including those of the brain, liver, and thyroid gland. (From Martindale, The Extra Pharmacopoeia, 30th ed, p1162)",MSH,"Intravenous compound used for PET scans to assess glucose metabolism in stroke, ischemia, and detect tumors in various organs."
C0543467,"Operations carried out for the correction of deformities and defects, repair of injuries, and diagnosis and cure of certain diseases. (Taber, 18th ed.).",MSH,"Medical operations correct deformities, repair injuries, and cure diseases to improve patient health and well-being."
C0549183,"A medial line, especially the medial line or medial plane of the body (or some part of the body).",NCI,"The term refers to a middle line or plane in the body, commonly used to describe its central axis."
C1705504,"Human KAT5 wild-type allele is located within 11q13 and is approximately 8 kb in length. This allele, which encodes histone acetyltransferase KAT5 protein, is involved in the acetylation of nucleosomal histones H4 and H2A.",NCI,The human KAT5 allele on chromosome 11 encodes a protein that acetylates histones H4 and H2A.
C0085590,"A flexible, tubular device that is used to carry fluids into or from a blood vessel, hollow organ, or body cavity.",MSH,A catheter is a flexible tube used to deliver or remove fluids from the body through blood vessels or cavities.
C0018787,"The hollow, muscular organ that maintains the circulation of the blood.",MSH,"The heart is a hollow, muscular organ responsible for maintaining blood circulation in the body."
C0011334,"Localized destruction of the tooth surface initiated by decalcification of the enamel followed by enzymatic lysis of organic structures and leading to cavity formation. If left unchecked, the cavity may penetrate the enamel and dentin and reach the pulp.",MSH,"Tooth decay is the erosion of the tooth caused by decalcification and organic breakdown, potentially reaching the pulp."
C0021853,The section of the alimentary canal from the STOMACH to the ANAL CANAL. It includes the LARGE INTESTINE and SMALL INTESTINE.,MSH,"The gastrointestinal tract is from the stomach to the anal canal, including the large intestine and small intestine."
C1511606,A pathologic process that contains a single or multiple sac-like spaces.,NCI,A medical keyword describing the presence of one or more sac-like spaces within a pathological process.
C0000833,"Accumulation of purulent material in tissues, organs, or circumscribed spaces, usually associated with signs of infection.",MSH,Pus buildup in body areas causing infection signs.
C0700124,The condition of being dilated or stretched.,NCI,"Being dilated or stretched refers to the condition of being enlarged or expanded, typically within a medical context."
C0205385,None,None,None
C0332448,The process of the diffusion or accumulation in a tissue or cells of a substance not normal to it or in amounts above normal. (NCI),NCI,"Abnormal build-up or spread of a substance in tissue or cells, exceeding normal levels, known as diffusion or accumulation."
C0521530,A chest X-ray finding indicating the presence of a radio-opaque area in the lung. The opacification is caused by fluid or solid material within the airways or lung parenchyma.,NCI,Chest X-ray shows radio-opaque area in lung due to fluid or solid material inside airways or lung tissue.
C0728985,The set of vertebrae immediately caudal to the skull.,NCI,"The set of vertebrae right after the skull, towards the tail end of the body."
C0444708,None,None,None
C0678234,None,None,None
C0037303,The SKELETON of the HEAD including the FACIAL BONES and the bones enclosing the BRAIN.,MSH,"The skull is the framework of the head, consisting of facial bones and bones protecting the brain."
C0034606,"The production of an image obtained by cameras that detect the radioactive emissions of an injected radionuclide as it has distributed differentially throughout tissues in the body. The image obtained from a moving detector is called a scan, while the image obtained from a stationary camera device is called a scintiphotograph.",MSH,"Medical keyword: Imaging technique using cameras to detect radioactive emissions of injected radionuclide, providing scan or scintiphotograph images."
C1699633,An imaging technique that combines a POSITRON-EMISSION TOMOGRAPHY (PET) scanner and a CT X RAY scanner. This establishes a precise anatomic localization in the same session.,MSH,PET/CT scan combines imaging from PET and CT scanners to provide both functional and anatomical information in one session.
C0225706,The 3-lobed lung located on the right side of the body.,NCI,Right-sided tri-lobed lung structure is a vital organ responsible for gas exchange in the respiratory system.
C0086296,None,None,None
C0016976,"A storage reservoir for BILE secretion. Gallbladder allows the delivery of bile acids at a high concentration and in a controlled manner, via the CYSTIC DUCT to the DUODENUM, for degradation of dietary lipid.",MSH,Gallbladder stores and releases concentrated bile to aid in the digestion of dietary lipids through the cystic duct.
C0333307,None,None,None
C0025066,"A membrane in the midline of the THORAX of mammals. It separates the lungs between the STERNUM in front and the VERTEBRAL COLUMN behind. It also surrounds the HEART, TRACHEA, ESOPHAGUS, THYMUS, and LYMPH NODES.",MSH,The mediastinum is a central membrane in the thorax that separates the lungs and contains important organs like the heart.
C0376443,An ultrasound administered by using a tube containing flexible fibre optic wires that allows for the analysis of tissues inside the body. Ultrasound technology utilizes high frequency waves and their echoes to produce an image. 2005,NCI,Flexible fibre optic ultrasound tube allows analysis of internal body tissues using high frequency wave echoes to produce images.
C0205216,A subjective response indicating that something is or has decreased.,NCI,Subjective indication of decrease.
C0205307,"In pathology, a term that is used to describe a tissue specimen that has a normal appearance.",NCI,"""Normal-looking tissue sample used in pathology to describe a specimen with natural appearance."""
C0040426,One of a set of bone-like structures in the mouth used for biting and chewing.,MSH,Teeth are bone-like structures in the mouth that are used for biting and chewing during the process of eating.
C0037949,The spinal or vertebral column.,MSH,The spinal column is the central support structure of the body made up of individual vertebrae stacked together.
C0227230,The main section of the digestive tube that connects the esophagus to the small intestine. The body proper excludes the upper and lower sections of the fundus and pyloric portion respectively.,NCI,"The main section of the digestive tube connecting the esophagus to the small intestine, excluding the fundus and pyloric portion."
C0035359,"An area occupying the most posterior aspect of the ABDOMINAL CAVITY. It is bounded laterally by the borders of the quadratus lumborum muscles and extends from the DIAPHRAGM to the brim of the true PELVIS, where it continues as the pelvic extraperitoneal space.",MSH,"The retroperitoneum is the area at the back of the abdominal cavity, bordered by the quadratus lumborum muscles."
C1510412,"Not an aneurysm but a well-defined collection of blood and CONNECTIVE TISSUE outside the wall of a blood vessel or the heart. It is the containment of a ruptured blood vessel or heart, such as sealing a rupture of the left ventricle. False aneurysm is formed by organized THROMBUS and HEMATOMA in surrounding tissue.",MSH,False aneurysm is a well-defined collection of blood and connective tissue outside a blood vessel or heart wall.
C0040184,"The second longest bone of the skeleton. It is located on the medial side of the lower leg, articulating with the FIBULA laterally, the TALUS distally, and the FEMUR proximally.",MSH,"The tibia is the second longest bone in the body, connecting the knee and ankle joints in the lower leg."
C0442726,"Perceived, discerned, or discovered.",NCI,"Perceived, discerned, or discovered in the medical field summarized briefly."
C0042458,The venous trunk which receives blood from the lower extremities and from the pelvic and abdominal organs.,MSH,The inferior vena cava is a large vein that collects blood from the lower body and abdominal organs.
C0042149,"The hollow thick-walled muscular organ in the female PELVIS. It consists of the fundus which is the site of EMBRYO IMPLANTATION and FETAL DEVELOPMENT. Beyond the isthmus at the perineal end of fundus, is CERVIX UTERI (the neck) opening into VAGINA. Beyond the isthmi at the upper abdominal end of fundus, are the FALLOPIAN TUBES.",MSH,"The uterus is a hollow, muscular organ in the female pelvis where embryo implantation and fetal development occur."
C0205098,Toward the middle or inside (as opposed to lateral).,NCI,The term refers to structures that are situated closer to the center of the body rather than the sides.
C0009368,The segment of LARGE INTESTINE between the CECUM and the RECTUM. It includes the ASCENDING COLON; the TRANSVERSE COLON; the DESCENDING COLON; and the SIGMOID COLON.,MSH,"The part of the large intestine between the cecum and rectum, comprising the ascending, transverse, descending, and sigmoid colon."
C0005847,"Any of the tubular vessels conveying the blood (arteries, arterioles, capillaries, venules, and veins).",MSH,"Blood vessels carry blood throughout the body, including arteries, arterioles, capillaries, venules, and veins, in a complex network."
C0001779,How long something has existed; elapsed time since birth.,NCI,"Duration since inception, indicating length of existence or elapsed time since birth, referred to as age or longevity."
C0220825,"Systematic, objective appraisal of the significance, effectiveness, and impact of activities or condition according to specified objectives and criteria.",NCI,"Evaluating activities or conditions based on set goals and criteria to determine their significance, effectiveness, and impact."
C0524461,None,None,None
C0019080,Bleeding or escape of blood from a vessel.,MSH,"Bleeding is the escape of blood from a vessel, signifying a potential medical emergency that requires prompt attention."
C0021852,"The portion of the GASTROINTESTINAL TRACT between the PYLORUS of the STOMACH and the ILEOCECAL VALVE of the LARGE INTESTINE. It is divisible into three portions: the DUODENUM, the JEJUNUM, and the ILEUM.",MSH,The small intestine is the section of the gastrointestinal tract between the stomach and the large intestine.
C0205251,"A minimum level or position or degree; less than normal in degree, intensity or amount.",NCI,"Medical keyword: Hypo- A term indicating a below-normal level, position, or degree of intensity, quantity, or severity."
C0205145,A position in relation to its surroundings.,NCI,"""Positioning is important in medical procedures to ensure accuracy and effectiveness in relation to the patient's surroundings."""
C1282910,"In anatomy, indicating higher than a given reference point.",NCI,"Above a specific point in the body, this term in anatomy suggests a higher position relative to a reference point."
C1444754,"The linear extent in space from one end of something to the other end, or the extent of something from beginning to end.",NCI,"The length is the measurement from one point to another point, or the distance from start to finish."
C0028778,Blockage of the normal flow of the contents of an anatomical passageway.,NCI,"Obstruction in a passage prevents normal flow of contents, leading to potential complications and health issues in patients."
C0018670,"The upper part of the human body, or the front or upper part of the body of an animal, typically separated from the rest of the body by a neck, and containing the brain, mouth, and sense organs.",MSH,"The head is the upper part of the body, housing the brain, mouth, and sense organs, often separated by a neck."
C0031039,Fluid accumulation within the PERICARDIUM. Serous effusions are associated with pericardial diseases. Hemopericardium is associated with trauma. Lipid-containing effusion (chylopericardium) results from leakage of THORACIC DUCT. Severe cases can lead to CARDIAC TAMPONADE.,MSH,"Fluid accumulation in the pericardium can cause various conditions, including serous effusions, hemopericardium, and chylopericardium, leading to cardiac tamponade."
C0079946,"System of classification based on nation from which a person originates, regardless of the nation in which he/she currently resides.",NCI,"Medical keyword: Nationality-based classification system independent of current residency, based on country of origin."
C0733755,"A reference to the alignment of an object, a particular situation or view of a situation, or the location of an object.",NCI,"The keyword refers to the positioning or orientation of an object, situation, view, or location in a medical context."
C0742919,Computed tomography that uses a contrast agent to visualize anatomic structures.,NCI,CT scan with contrast highlights anatomical structures for enhanced imaging clarity and accuracy.
C0003842,The vessels carrying blood away from the heart.,MSH,Arteries transport oxygen-rich blood away from the heart to nourish the body's cells and tissues.
C0225730,The 2-lobed lung located on the left side of the body.,NCI,The left lung has two lobes and is found on the left side of the body.
C0011980,The musculofibrous partition that separates the THORACIC CAVITY from the ABDOMINAL CAVITY. Contraction of the diaphragm increases the volume of the thoracic cavity aiding INHALATION.,MSH,"The diaphragm is a musculofibrous partition separating the thoracic and abdominal cavities, aiding in inhalation by expanding the thoracic cavity."
C0205081,<p>Indicates the condition may result in noticable adverse adverse consequences but is unlikely to be life-threatening or cause permanent injury.</p>,HL7V3.0,Condition has potential for noticeable negative effects but is not life-threatening or permanently harmful.
C0332575,None,None,None
C0870221,None,None,None
C0015811,"The longest and largest bone of the skeleton, it is situated between the hip and the knee.",MSH,The femur is the largest and longest bone located between the hip and knee in the human skeleton.
C0015813,"The hemispheric articular surface at the upper extremity of the thigh bone. (Stedman, 26th ed)",MSH,The upper end of the thigh bone has a rounded surface that forms the hip joint socket.
C0024204,They are oval or bean shaped bodies (1 - 30 mm in diameter) located along the lymphatic system.,MSH,"Oval or bean-shaped bodies, ranging from 1 - 30 mm in diameter, found along the lymphatic system."
C0037925,A cylindrical column of tissue that lies within the vertebral canal. It is composed of WHITE MATTER and GRAY MATTER.,MSH,"The spinal cord is a tissue column containing white and grey matter, located within the vertebral canal."
C0227579,That portion of the pancreas lying in the concavity of the duodenum.,NCI,The portion of the pancreas located in the concavity of the duodenum is called the pancreatic head.
C0003962,Accumulation or retention of free fluid within the peritoneal cavity.,MSH,Excessive free fluid buildup in the abdomen can lead to a condition known as peritoneal effusion.
C0205129,None,None,None
C0012691,Displacement of bones from their normal positions at a joint.,MSH,Dislocation: Bones moving out of their usual place in a joint.
C0746405,None,None,None
C0027551,Sharp instruments used for puncturing or suturing.,MSH,Sharp medical tools for puncturing or stitching wounds are essential for surgical procedures.
C0332479,The spatial arrangement of something as distinct from its substance.,NCI,"Spatial arrangement refers to the physical layout or arrangement of something, separate from the actual material or substance."
C0442800,None,None,None
C0309093,None,None,None
C0185023,"The act or operation of holding, suturing, or fastening in a fixed position",SNOMEDCT_US,"Hold, suture, or fasten something in place to secure it and prevent movement or displacement during a procedure."
C0205250,An elevated level or position or degree; greater than normal in degree or intensity or amount.,NCI,The patient's test results showed that they had an abnormally high level of a certain marker in their blood.
C0034896,"The distal segment of the LARGE INTESTINE, between the SIGMOID COLON and the ANAL CANAL.",MSH,"The distal segment of the large intestine, located between the sigmoid colon and the anal canal, is the rectum."
C0022742,A region of the lower extremity immediately surrounding and including the KNEE JOINT.,MSH,The knee joint area is part of the lower extremity and includes the surrounding region of the leg.
C2349975,To improve the quality of something; make better or more attractive.,NCI,Enhancing the effectiveness of treatments can lead to better outcomes and higher patient satisfaction in medical care.
C0020885,"The distal and narrowest portion of the SMALL INTESTINE, between the JEJUNUM and the ILEOCECAL VALVE of the LARGE INTESTINE.",MSH,The distal narrow part of the small intestine located between the jejunum and the ileocecal valve of the large intestine.
C1261316,A coronary artery that originates above the right coronary cusp and supplies blood predominantly to the right side of the heart.,NCI,A coronary artery above the right coronary cusp primarily supplies blood to the right side of the heart.
C4085887,The maximum volume of gas an individual can inhale from the point of maximal exhalation.,NCI,Maximum inhalation capacity is the highest amount of air a person can inhale after full exhalation.
C4725622,"Terminology subset about descriptions of the timing by which an active ingredient is made available in the body after administration of the pharmaceutical product, in comparison with a conventional, direct release of the active ingredient.",NCI,This subset focuses on the timing of active ingredient release in the body after taking a pharmaceutical product.
C0015965,"The unborn young of a viviparous mammal, in the postembryonic period, after the major structures have been outlined. In humans, the unborn young from the end of the eighth week after CONCEPTION until BIRTH, as distinguished from the earlier EMBRYO, MAMMALIAN.",MSH,"The developed mammalian offspring during the late stages of pregnancy, between the eighth week after conception and birth."
C1261074,"The lobe of the right lung, situated above the horizontal fissure, which includes the apex.",NCI,"The upper part of the right lung, above the horizontal fissure and containing the apex."
C0012725,The process by which an emotional or behavioral response that is appropriate for one situation appears in another situation for which it is inappropriate.,MSH,"Inappropriate emotional or behavioral response occurring in a situation where it is not suitable, known as displacement."
C0037775,"The placement, arrangement of instance of entities within a space.",NCI,The spatial distribution of entities in a given area is known as the arrangement and placement of instances.
C0443285,None,None,None
C0227486,The smaller lobe of the liver extending into the left side of the body.,NCI,The left lobe of the liver is smaller and extends into the left side of the body.
C0003023,"A republic in southern Africa, southwest of DEMOCRATIC REPUBLIC OF THE CONGO and west of ZAMBIA. Its capital is Luanda.",MSH,"Southern African republic with Luanda as capital, bordered by Zambia and Democratic Republic of the Congo in the southwest."
C4028269,None,None,None
